DIRAC serial starts by allocating 64000000 words (    488.28 MB -      0.477 GB)
 of memory    out of the allowed maximum of 2147483648 words (  16384.00 MB -     16.000 GB)

Note: maximum allocatable memory for serial run can be set by pam --aw/--ag

 *******************************************************************************
 *                                                                             *
 *                                O U T P U T                                  *
 *                                   from                                      *
 *                                                                             *
 *                   @@@@@    @@   @@@@@     @@@@     @@@@@                    *
 *                   @@  @@        @@  @@   @@  @@   @@                        *
 *                   @@  @@   @@   @@@@@    @@@@@@   @@                        *
 *                   @@  @@   @@   @@ @@    @@  @@   @@                        *
 *                   @@@@@    @@   @@  @@   @@  @@    @@@@@                    *
 *                                                                             *
 *                                                                             *
 %}ZS)S?$=$)]S?$%%>SS$%S$ZZ6cHHMHHHHHHHHMHHM&MHbHH6$L/:<S///</:|/:|:/::!:.::--:%
 $?S$$%$$$$?%?$(SSS$SSSHMMMMMMMMMMMMMMMMMM6H&6S&SH&&k?6$r~::://///::::::.:::-::$
 (%?)Z??$$$(S%$>$)S6HMMMMMMMMMMMMMMMMMMMMMMR6M]&&$6HR$&6(i::::::|i|:::::::-:-::(
 $S?$$)$?$%?))?S/]#MMMMMMMMMMMMMMMMMMMMMMMMMMHM1HRH9R&$$$|):?:/://|:/::/:/.::.:$
 SS$%%?$%((S)?Z[6MMMMMMMMMMMMMMMMMMMMMMMMMMMMMMMMM&HF$$&/)S?<~::!!:::::::/:-:|.S
 SS%%%%S$%%%$$MMMMMMMMMMMMMMMMMMMMMMMMMMMMMMMMMMMHHHHHHM>?/S/:/:::`:/://:/::-::S
 ?$SSSS?%SS$)MMMMMMMMMMMMMMMMMMMMMMMMMMMMMMMMMMMMMMMMMMM/4?:S:/:::/:::/:/:::.::?
 S$(S?S$%(?$HMMMMMMMMMMMMMMMMM#&7RH99MMMMMMMMMMMMMMMMMMHHHd$/:::::/::::::-//.:.S
 (?SS(%)S&HMMMMMMMMMMMMMMMMM#S|///???$9HHMMMMMMMMMDSZ&1S/?</>?~:///::|/!:/-:-:.(
 $S?%?<H(MMMMMMMMMMMMMMMMR?`. :.:`::<>:``?/*?##*)$:/>       `((%://::/:::::/::/$
 S$($$)HdMMMMMMMMMMMMMMMP: . `   `  `    `      `-            `Z<:>?::/:::::|:iS
 c%%%&HMMMMMMMMMMMMMMMM6:                                      `$%)>%%</>!:::::c
 S?%/MMMMMMMMMMMMMMMMMMH-                                        /ZSS>?:?~:;/::S
 $SZ?MMMMMMMMMMMMMMMMMH?.                                        \"&((/?//?|:::$
 $%$%&MMMMMMMMMMMMMMMMM:.                                          ?%/S:</::/::$
 ($?}&HMMMMMMMMMMMMMMMM>:                                          $%%<?/i:|i::(
 Z$($&MMMMMMMMMMMMMMMMHk(:.  . -                                   .S/\?\?/!:/:Z
 (??$<HMMMMMMMMMMMMMMMFk|:   -.-.                                  :%/%/(:/:ii|(
 SZ(S?]MMMMMMMMMMMMMMHS?:- -  ::.:                                  |/S:</::?||S
 $%)$$(MMMMMMMMMMMMMMR):`:. :.:::`,,/bcokb/_                       :S?%?|~:/:/:$
 %$$%$)[[?$?MMMMMMMMMM: :.:-.::::$7?<&7&MMMMMMM#/           _ .. ..:</?:(:/::::%
 $$$?Z?HHH~|/MMMMMMMMM/`.-.:.:/:%%%%?dHMMMMMMMMMMH?,-   .,bMMMM6//./i~/~:<:::/:$
 $($S$M//::S?ZHMMMMMH/:.`:::.:/%S/&MMHMMMMMMMMRM&><   ,HMMMMMMMF  :::?:///:|:::$
 )[$S$S($|_i:#>::*H&?/::.::/:\"://:?>>`:&HMHSMMMM$:`-   MMHMMMMHHT .)i/?////::/)
 $$[$$>$}:dHH&$$--?S::-:.:::--/-:``./::>%Zi?)&/?`:.`   `H?$T*\" `  /%?>%:)://ii$
 $&=&/ZS}$RF<:?/-.|%r/:::/:/:`.-.-..|::S//!`\"``          >??:    `SS<S:)!/////$
 Z&]>b[Z(Z?&%:::../S$$:>:::i`.`. `-.`  `                         ,>%%%:>/>/!|:/Z
 $$&/F&1$c$?>:>?/,>?$$ZS/::/:-: ...                              |S?S)S?<~:::::$
 &$&$&$k&>>|?<:<?((/$[/?)i~/:/. - -                              S?:%%%?/:::/::&
 =[/Z[[Fp[MMH$>?Z&S$$$/$S///||..-           -.-                  /((S$:%<:///:/=
 $&>1MHHMMMM6M9MMMM$Z$}$S%/:::.`.            .:/,,,dcb>/:.       ((SSSS%:)!//i|$
 MMMMMMMMMMMR&&RRRHR&&($(?:|i::-             .:%&S&$[&H&``     ../>%;/?>??:<::>M
 MMMMMMMMMMMMS/}S$&&H&[$SS//:::.:.   . . .v</Jq1&&D]&M&<,      :/::/?%%)S>?://:M
 MMMMMMMMMMMM?}$/$$kMM&&$(%/?//:..`.  .|//1d/`://?*/*/\"` `     .:/(SS$%(S%)):%M
 MMMMMMMMMMMM(}$$>&&MMHR#$S%%:?::.:|-.`:;&&b/D/$p=qpv//b/~`   :/~~%%??$=$)Z$S+;M
 MMMMMMMMMMMM[|S$$Z1]MMMMD[$?$:>)/::: :/?:``???bD&{b<<-`     .,:/)|SS(}Z/$$?/<SM
 MMMMMMMMMMMM||$)&7k&MMMMH9]$$??Z%|!/:i::`  `` .             SS?SS?Z/]1$/&$c/$SM
 MMMMMMMMMMMM| -?>[&]HMMMMMMMH1[/7SS(?:/..-` ::/Sc,/_,     _<$?SS%$S/&c&&$&>//<M
 MMMMMMMMMMMMR  `$&&&HMM9MMMMMMM&&c$%%:/:/:.:.:/\?\?/\    _MMHk/7S/]dq&1S<&&></M
 MMMMMMMMMMMMM?  :&96MHMMMMMMMMMMMHHk[S%(<<:// `         ,MMMMMMM&/Z6H]DkH]1$&&M
 MMMMMMMMMMMMMD    99H9HMMMMMMMMMMMMMMMb&%$<:i.:....    .MMMMMMMMM6HHHRH&H&H1SFM
 MMMMMMMMMMMMMM|   `?HMMMMMMMMMMMMMMMMMMMHk6k&>$&Z$/?_.bHMMMMMMMMMMM&6HRM9H6]ZkM
 MMMMMMMMMMMMMMM/    `TMMMMMMMMMMMMMMMMMMMMMMMMMMMMMMMMMMMMMMMMMMMMMMHMH6RH&R6&M
 MMMMMMMMMMMMMMMM    -|?HMMMMMMMMMMMMMMMMMMMMMMMMMMMMMMMMMMMMMMMMMMMMMFHH6HMD&&M
 MMMMMMMMMMMMMMMMk  ..:~?9MMMMMMMMMMMMM#`:MMMMMMMMMMMMMMMMMMMMMMMMMMMMM9MHkR6&FM
 MMMMMMMMMMMMMMMMM/  .-!:%$ZHMMMMMMMMMR` dMMMMMMMMMMMMMMMMMMMMMMMMMMMMM9MRMHH9&M
 MMMMMMMMMMMMMMMMMML,:.-|::/?&&MMMMMM` .MMMMMMMMMMMMMMMMMMMMMMMMMMMMMMMMHRMH&&6M
 MMMMMMMMMMMMMMMMMMMc%>/:::i<:SMMMMMMHdMMMMMMMMMMMMMMMMMMMMMMMMMMMMMMMMHHM&969kM
 MMMMMMMMMMMMMMMMMMMMSS/$$/(|HMMMMMMMMMMMMMMMMMMMMMMMMMMMMMMMMMMMMMMMMMMMHH&HH&M
 MMMMMMMMMMMMMMMMMMMM6S/?/MMMMMMMMMMMMMMMMMMMMMMMMMMMMMMMMMMMMMMMMMMMMMR96H1DR1M
 MMMMMMMMMMMMMMMMMMMMM&$MHMMMMMMMMMMMMMMMMMMMMMMMMMMMMMMMMMMMMMMMMMMMMMHMH691&&M
 MMMMMMMMMMMMMMMMMMMMMMMMMMMMMMMMMMMMMMMMMMMMMMMMMMMMMMMMMMMMMMMMMMMMMMMMH&R&9ZM
 MMMMMMMMMMMMMMMMMMMMMMMMMRHMMMMMMMMMMMMMMMMMMMMMMMMMMMMMMMMMMMMMMMMMMMMH&96][6M
 MMMMMMMMMMMMMMMMMMMMMMMMp?:MMMMMMMMMMMMMMMMMMMMMMMMMMMMMMMMMMMMMMMMMMM96HH1][FM
 MMMMMMMMMMMMMMMMMMMMMMMM> -HMMMMMMMMMMMMMMMMMMMMMMMMMMMMMMMMMMMMMMMMMMMH&1k&$&M
 *******************************************************************************
 *                                                                             *
 *         =========================================================           *
 *                     Program for Atomic and Molecular                        *
 *          Direct Iterative Relativistic All-electron Calculations            *
 *         =========================================================           *
 *                                                                             *
 *                                                                             *
 *    Written by:                                                              *
 *                                                                             *
 *    Andre S. P. Gomes        CNRS/Universite de Lille          France        *
 *    Trond Saue               Universite Toulouse III           France        *
 *    Lucas Visscher           Vrije Universiteit Amsterdam      Netherlands   *
 *    Hans Joergen Aa. Jensen  University of Southern Denmark    Denmark       *
 *    Radovan Bast             UiT The Arctic University of      Norway        *
 *                                                                             *
 *    with contributions from:                                                 *
 *                                                                             *
 *    Ignacio Agustin Aucar    Northeast National University     Argentina     *
 *    Vebjoern Bakken          University of Oslo                Norway        *
 *    Kenneth G. Dyall         Schrodinger, Inc., Portland       USA           *
 *    Sebastien Dubillard      University of Strasbourg          France        *
 *    Ulf Ekstroem             University of Oslo                Norway        *
 *    Ephraim Eliav            University of Tel Aviv            Israel        *
 *    Thomas Enevoldsen        University of Southern Denmark    Denmark       *
 *    Elke Fasshauer           University of Aarhus              Denmark       *
 *    Timo Fleig               Universite Toulouse III           France        *
 *    Olav Fossgaard           UiT The Arctic University of      Norway        *
 *    Loic Halbert             Universite de Lille               France        *
 *    Erik D. Hedegaard        Lund University                   Sweden        *
 *    Trygve Helgaker          University of Oslo                Norway        *
 *    Benjamin Helmich-Paris   Max Planck Institute f. Coal Res. Germany       *
 *    Johan Henriksson         Linkoeping University             Sweden        *
 *    Miroslav Ilias           Matej Bel University              Slovakia      *
 *    Christoph R. Jacob       TU Braunschweig                   Germany       *
 *    Stefan Knecht            ETH Zuerich                       Switzerland   *
 *    Stanislav Komorovsky     UiT The Arctic University of      Norway        *
 *    Ossama Kullie            University of Kassel              Germany       *
 *    Jon K. Laerdahl          University of Oslo                Norway        *
 *    Christoffer V. Larsen    University of Southern Denmark    Denmark       *
 *    Yoon Sup Lee             KAIST, Daejeon                    South Korea   *
 *    Huliyar S. Nataraj       BME/Budapest Univ. Tech. & Econ.  Hungary       *
 *    Malaya Kumar Nayak       Bhabha Atomic Research Centre     India         *
 *    Patrick Norman           Stockholm Inst. of Technology     Sweden        *
 *    Malgorzata Olejniczak    University of Warsaw              Poland        *
 *    Jeppe Olsen              Aarhus University                 Denmark       *
 *    Jogvan Magnus H. Olsen   University of Southern Denmark    Denmark       *
 *    Young Choon Park         KAIST, Daejeon                    South Korea   *
 *    Jesper K. Pedersen       University of Southern Denmark    Denmark       *
 *    Markus Pernpointner      University of Heidelberg          Germany       *
 *    Roberto Di Remigio       UiT The Arctic University of      Norway        *
 *    Kenneth Ruud             UiT The Arctic University of      Norway        *
 *    Pawel Salek              Stockholm Inst. of Technology     Sweden        *
 *    Bernd Schimmelpfennig    Karlsruhe Institute of Technology Germany       *
 *    Bruno Senjean            University of Leiden              Netherlands   *
 *    Avijit Shee              University of Michigan            USA           *
 *    Jetze Sikkema            Vrije Universiteit Amsterdam      Netherlands   *
 *    Andreas J. Thorvaldsen   UiT The Arctic University of      Norway        *
 *    Joern Thyssen            University of Southern Denmark    Denmark       *
 *    Joost N. P. van Stralen  Vrije Universiteit Amsterdam      Netherlands   *
 *    Marta L. Vidal           Technical University of Denmark   Denmark       *
 *    Sebastien Villaume       Linkoeping University             Sweden        *
 *    Olivier Visser           University of Groningen           Netherlands   *
 *    Toke Winther             University of Southern Denmark    Denmark       *
 *    Shigeyoshi Yamamoto      Chukyo University                 Japan         *
 *                                                                             *
 *    For more information about the DIRAC code see http://diracprogram.org    *
 *                                                                             *
 *    This is an experimental code. The authors accept no responsibility       *
 *    for the performance of the code or for the correctness of the results.   *
 *                                                                             *
 *    The code (in whole or part) is not to be reproduced for further          *
 *    distribution without the written permission of the authors or            *
 *    their representatives.                                                   *
 *                                                                             *
 *    If results obtained with this code are published, an                     *
 *    appropriate citation would be:                                           *
 *                                                                             *
 *    DIRAC, a relativistic ab initio electronic structure program,            *
 *    Release DIRAC19 (2019), written by                                       *
 *    A. S. P. Gomes, T. Saue, L. Visscher, H. J. Aa. Jensen, and R. Bast,     *
 *    with contributions from I. A. Aucar, V. Bakken, K. G. Dyall,             *
 *    S. Dubillard, U. Ekstroem, E. Eliav, T. Enevoldsen, E. Fasshauer,        *
 *    T. Fleig, O. Fossgaard, L. Halbert, E. D. Hedegaard, T. Helgaker,        *
 *    J. Henriksson, M. Ilias, Ch. R. Jacob, S. Knecht, S. Komorovsky,         *
 *    O. Kullie, J. K. Laerdahl, C. V. Larsen, Y. S. Lee, H. S. Nataraj,       *
 *    M. K. Nayak, P. Norman, M. Olejniczak, J. Olsen, J. M. H. Olsen,         *
 *    Y. C. Park, J. K. Pedersen, M. Pernpointner, R. Di Remigio, K. Ruud,     *
 *    P. Salek, B. Schimmelpfennig, B. Senjean, A. Shee, J. Sikkema,           *
 *    A. J. Thorvaldsen, J. Thyssen, J. N. P. van Stralen, M. L. Vidal,        *
  *    S. Villaume, O. Visser, T. Winther, and S. Yamamoto,                     *
 *    (see http://diracprogram.org).                                           *
 *                                                                             *
 *******************************************************************************


Version information
-------------------

Branch        | master
Commit hash   | a7757fca7
Commit author | Miroslav Iliaš
Commit date   | Mon May 25 09:56:34 2020 +0000


Configuration and build information
-----------------------------------

Who compiled             | agustin
Compiled on server       | agustin-laptop
Operating system         | Linux-5.4.0-31-generic
CMake version            | 3.16.3
CMake generator          | Unix Makefiles
CMake build type         | release
Configuration time       | 2020-05-25 11:41:15.781682
Python version           | 2.7.1
Fortran compiler         | /usr/bin/gfortran
Fortran compiler version | 9.3.0
Fortran compiler flags   |  -g -fcray-pointer -fbacktrace -fno-range-check -DVAR_GFORTRAN -DVAR_MFDS
C compiler               | /usr/bin/gcc
C compiler version       | 9.3.0
C compiler flags         |  -g
C++ compiler             | /usr/bin/g++
C++ compiler version     | 9.3.0
C++ compiler flags       |  -g -Wall -Wno-unknown-pragmas -Wno-sign-compare -Woverloaded-virtual -Wwrite-strings -Wno-unused
Static linking           | False
64-bit integers          | False
MPI parallelization      | False
MPI launcher             | unknown
Math libraries           | /usr/lib/x86_64-linux-gnu/liblapack.so;/usr/lib/x86_64-linux-gnu/libblas.so
Builtin BLAS library     | OFF
Builtin LAPACK library   | OFF
Explicit libraries       | unknown
Compile definitions      | HAVE_SYSTEM_NATIVE_BLAS;HAVE_SYSTEM_NATIVE_LAPACK;MOD_UNRELEASED;SYS_LINUX;PRG_DIRAC;INSTALL_WRKMEM=64000000;HAS_PCMSOLVER;BUILD_GEN1INT;HAS_PELIB;MOD_QCORR;HAS_STIELTJES;MOD_INTEREST;MOD_LAO_REARRANGED;MOD_MCSCF_spinfree;MOD_AOOSOC;MOD_ESR;MOD_KRCC;MOD_SRDFT;HAS_LAPLACE


 LAPACK integer*4/8 selftest passed
 Selftest of ISO_C_BINDING Fortran - C/C++ interoperability PASSED

Execution time and host
-----------------------

 
     Date and time (Linux)  : Thu May 28 14:39:40 2020
     Host name              : agustin-laptop                          


Contents of the input file
--------------------------

**DIRAC                                                                                             
.TITLE                                                                                              
Projection analysis for CH4                                                                         
.WAVE FUNCTION                                                                                      
.ANALYZE                                                                                            
**GENERAl                                                                                           
.ACMOUT                                                                                             
**WAVE FUNCTIONS                                                                                    
.SCF                                                                                                
*SCF                                                                                                
.CLOSED SHELL                                                                                       
 10                                                                                                 
**ANALYZE                                                                                           
.MULPOP                                                                                             
.PROJEC                                                                                             
*PROJEC                                                                                             
.ATOMS                                                                                              
AFCXXX                                                                                              
1..5                                                                                                
AFH1XX                                                                                              
1                                                                                                   
**MOLECULE                                                                                          
*BASIS                                                                                              
.DEFAULT                                                                                            
 cc-pVDZ                                                                                            
*END OF                                                                                             


Contents of the molecule file
-----------------------------

    5                                                                                               
                                                                                                    
C     0.0000000000   0.0000000000   0.0000000000                                                    
H     0.6270023464   0.6270023464   0.6270023464                                                    
H    -0.6270023464  -0.6270023464   0.6270023464                                                    
H     0.6270023464  -0.6270023464  -0.6270023464                                                    
H    -0.6270023464   0.6270023464  -0.6270023464                                                    


    *************************************************************************
    ********************** Projection analysis for CH4 **********************
    *************************************************************************

 Jobs in this run:
   * Wave function
   * Analysis


    **************************************************************************
    ************************** General DIRAC set-up **************************
    **************************************************************************

 The 2018 CODATA Recommended Values of the Fundamental Physical Constants (Web Version 8.1)
        Eite Tiesinga, Peter J. Mohr, David B. Newell, and Barry N. Taylor                 
        Database developed by J. Baker, M. Douma, and S. Kotochigova                       
  Available at http://physics.nist.gov/constants                                           
  National Institute of Standards and Technology, Gaithersburg, MD 20899                   
 * The speed of light :        137.0359992
 * Running in four-component mode
 * Direct evaluation of the following two-electron integrals:
   - LL-integrals
   - SL-integrals
   - SS-integrals
   - GT-integrals
 * Spherical transformation embedded in MO-transformation
   for large components
 * Transformation to scalar RKB basis embedded in
   MO-transformation for small components
 * Thresholds for linear dependence:
   Large components:   1.00D-06
   Small components:   1.00D-08
 * MO-coefficients dumped in C1 format to unformatted file DFACMO
 * General print level   :   0


    *************************************************************************
    ****************** Output from HERMIT input processing ******************
    *************************************************************************



   ***************************************************************************
   ****************** Output from MOLECULE input processing ******************
   ***************************************************************************



                     SYMADD: Detection of molecular symmetry
                     ---------------------------------------

 Symmetry test threshold:  5.00E-06

    The molecule has been centered at center of mass

 Symmetry point group found: T(d)           

 Rotational Axes
 ---------------
       3 :     -0.57735027    -0.57735027    -0.57735027  Isotope  0
       3 :      0.57735027     0.57735027    -0.57735027  Isotope  0
       3 :      0.57735027    -0.57735027     0.57735027  Isotope  0
       3 :     -0.57735027     0.57735027     0.57735027  Isotope  0
       2 :      0.00000000     0.00000000     1.00000000  Isotope  0
       2 :      0.00000000     1.00000000     0.00000000  Isotope  0
       2 :      1.00000000    -0.00000000     0.00000000  Isotope  0

 Improper Rotational Axes
 ------------------------
       4 :      0.00000000     0.00000000     1.00000000  Isotope  0
       4 :     -1.00000000     0.00000000     0.00000000  Isotope  0
       4 :      0.00000000     1.00000000     0.00000000  Isotope  0

 Mirror planes
 -----------------------------
 #1 = Type: 2=h, 1=v, 0=other
 #2 = Number of atoms in plane
 #3-5 = normal vector of plane
 -----------------------------
 0     1 :      0.70710678    -0.00000000    -0.70710678
 0     1 :     -0.00000000    -0.70710678     0.70710678
 0     1 :     -0.70710678     0.70710678     0.00000000
 0     0 :      0.70710678    -0.00000000     0.70710678
 0     0 :      0.00000000     0.70710678     0.70710678
 0     0 :      0.70710678     0.70710678     0.00000000

 The following symmetry elements were found: YZ XZ    


  Symmetry Operations
  -------------------

  Symmetry operations: 2



                          SYMGRP:Point group information
                          ------------------------------

Full group is:  T(d)           
Represented as: D2 

   * The point group was generated by:

      Rotation about the x-axis
      Rotation about the y-axis

   * Group multiplication table

        |  E   C2z  C2y  C2x
   -----+--------------------
     E  |  E   C2z  C2y  C2x
    C2z | C2z   E   C2x  C2y
    C2y | C2y  C2x   E   C2z
    C2x | C2x  C2y  C2z   E 

   * Character table

        |  E   C2z  C2y  C2x
   -----+--------------------
    A   |   1    1    1    1
    B2  |   1   -1    1   -1
    B3  |   1   -1   -1    1
    B1  |   1    1   -1   -1

   * Direct product table

        | A    B2   B3   B1 
   -----+--------------------
    A   | A    B2   B3   B1 
    B2  | B2   A    B1   B3 
    B3  | B3   B1   A    B2 
    B1  | B1   B3   B2   A  


                            **************************
                            *** Output from DBLGRP ***
                            **************************

   * One fermion irrep:   E1 
   * Real group. NZ = 1
   * Direct product decomposition:
          E1  x E1  : A   + B1  + B2  + B3 


                                 Spinor structure
                                 ----------------


   * Fermion irrep no.: 1
      La  |  A  (1)  B1 (2)  |
      Sa  |  A  (1)  B1 (2)  |
      Lb  |  B2 (3)  B3 (4)  |
      Sb  |  B2 (3)  B3 (4)  |


                              Quaternion symmetries
                              ---------------------

    Rep  T(+)
    -----------------------------
    A    1
    B2   j
    B3   k
    B1   i

  QM-QM nuclear repulsion energy :     13.484876022099



  Atoms and basis sets
  --------------------

  Number of atom types :    2
  Total number of atoms:    5

  label    atoms   charge   prim    cont     basis   
  ----------------------------------------------------------------------
  C           1       6      27      15      L  - [9s4p1d|3s2p1d]                                                
                             68      68      S  - [4s10p4d1f|4s10p4d1f]                                          
  H           4       1       7       5      L  - [4s1p|2s1p]                                                    
                             19      19      S  - [1s4p1d|1s4p1d]                                                
  ----------------------------------------------------------------------
                             55      35      L  - large components
                            144     144      S  - small components
  ----------------------------------------------------------------------
  total:      5      10     199     179

  Cartesian basis used.
  Threshold for integrals (to be written to file):  1.00D-15


  References for the basis sets
  -----------------------------

  Atom type   1   2
   Elements                             References                                
   --------                             ----------                                
   H      : T.H. Dunning, Jr. J. Chem. Phys. 90, 1007 (1989).                     
   He     : D.E. Woon and T.H. Dunning, Jr. J. Chem. Phys. 100, 2975 (1994).      
   Li - Ne: T.H. Dunning, Jr. J. Chem. Phys. 90, 1007 (1989).                     
   Na - Mg: D.E. Woon and T.H. Dunning, Jr.  (to be published)                    
   Al - Ar: D.E. Woon and T.H. Dunning, Jr.  J. Chem. Phys. 98, 1358 (1993).      
   Ca     : J. Koput and K.A. Peterson, J. Phys. Chem. A, 106, 9595 (2002).       
   Ga - Kr: A.K. Wilson, D.E. Woon, K.A. Peterson, T.H. Dunning, Jr.,             
            J. Chem. Phys., 110, 7667 (1999)                                      


  Cartesian Coordinates (bohr)
  ----------------------------

  Total number of coordinates: 15


   1   C        x      0.0000000000
   2            y      0.0000000000
   3            z      0.0000000000

   4   H    1   x      1.1848627142
   5            y      1.1848627142
   6            z     -1.1848627142

   7   H    2   x      1.1848627142
   8            y     -1.1848627142
   9            z      1.1848627142

  10   H    3   x     -1.1848627142
  11            y      1.1848627142
  12            z      1.1848627142

  13   H    4   x     -1.1848627142
  14            y     -1.1848627142
  15            z     -1.1848627142



  Cartesian coordinates in XYZ format (Angstrom)
  ----------------------------------------------

    5

C      0.0000000000   0.0000000000   0.0000000000
H      0.6270023464   0.6270023464  -0.6270023464
H      0.6270023464  -0.6270023464   0.6270023464
H     -0.6270023464   0.6270023464   0.6270023464
H     -0.6270023464  -0.6270023464  -0.6270023464


  Symmetry Coordinates
  --------------------

  Number of coordinates in each symmetry:     3    4    4    4


  Symmetry  A  ( 1)

    1   H     x    [  4  +    7  -   10  -   13 ]/4
    2   H     y    [  5  -    8  +   11  -   14 ]/4
    3   H     z    [  6  -    9  -   12  +   15 ]/4


  Symmetry  B2 ( 2)

    4   C     y    2
    5   H     x    [  4  -    7  -   10  +   13 ]/4
    6   H     y    [  5  +    8  +   11  +   14 ]/4
    7   H     z    [  6  +    9  -   12  -   15 ]/4


  Symmetry  B3 ( 3)

    8   C     x    1
    9   H     x    [  4  +    7  +   10  +   13 ]/4
   10   H     y    [  5  -    8  -   11  +   14 ]/4
   11   H     z    [  6  -    9  +   12  -   15 ]/4


  Symmetry  B1 ( 4)

   12   C     z    3
   13   H     x    [  4  -    7  +   10  -   13 ]/4
   14   H     y    [  5  +    8  -   11  -   14 ]/4
   15   H     z    [  6  +    9  +   12  +   15 ]/4


   Interatomic separations (in Angstroms):
   ---------------------------------------

            C           H  1        H  2        H  3        H  4

   C       0.000000
   H  1    1.086000    0.000000
   H  2    1.086000    1.773430    0.000000
   H  3    1.086000    1.773430    1.773430    0.000000
   H  4    1.086000    1.773430    1.773430    1.773430    0.000000




  Bond distances (angstroms):
  ---------------------------

                  atom 1     atom 2                           distance
                  ------     ------                           --------
  bond distance:    H  1       C                              1.086000
  bond distance:    H  2       C                              1.086000
  bond distance:    H  3       C                              1.086000
  bond distance:    H  4       C                              1.086000


  Bond angles (degrees):
  ----------------------

                  atom 1     atom 2     atom 3                   angle
                  ------     ------     ------                   -----
  bond angle:       H  2       C          H  1                 109.471
  bond angle:       H  3       C          H  1                 109.471
  bond angle:       H  3       C          H  2                 109.471
  bond angle:       H  4       C          H  1                 109.471
  bond angle:       H  4       C          H  2                 109.471
  bond angle:       H  4       C          H  3                 109.471



   Nuclear repulsion energy :   13.484876022099 Hartree


                                GETLAB: AO-labels
                                -----------------

   * Large components:   26
     1  L C   1 s        2  L C   1 px       3  L C   1 py       4  L C   1 pz       5  L C   1 dxx      6  L C   1 dxy 
     7  L C   1 dxz      8  L C   1 dyy      9  L C   1 dyz     10  L C   1 dzz     11  L H   1 s       12  L H   2 s   
    13  L H   3 s       14  L H   4 s       15  L H   1 px      16  L H   1 py      17  L H   1 pz      18  L H   2 px  
    19  L H   2 py      20  L H   2 pz      21  L H   3 px      22  L H   3 py      23  L H   3 pz      24  L H   4 px  
    25  L H   4 py      26  L H   4 pz  
   * Small components:   60
    27  S C   1 s       28  S C   1 px      29  S C   1 py      30  S C   1 pz      31  S C   1 dxx     32  S C   1 dxy 
    33  S C   1 dxz     34  S C   1 dyy     35  S C   1 dyz     36  S C   1 dzz     37  S C   1 fxxx    38  S C   1 fxxy
    39  S C   1 fxxz    40  S C   1 fxyy    41  S C   1 fxyz    42  S C   1 fxzz    43  S C   1 fyyy    44  S C   1 fyyz
    45  S C   1 fyzz    46  S C   1 fzzz    47  S H   1 s       48  S H   2 s       49  S H   3 s       50  S H   4 s   
    51  S H   1 px      52  S H   1 py      53  S H   1 pz      54  S H   2 px      55  S H   2 py      56  S H   2 pz  
    57  S H   3 px      58  S H   3 py      59  S H   3 pz      60  S H   4 px      61  S H   4 py      62  S H   4 pz  
    63  S H   1 dxx     64  S H   1 dxy     65  S H   1 dxz     66  S H   1 dyy     67  S H   1 dyz     68  S H   1 dzz 
    69  S H   2 dxx     70  S H   2 dxy     71  S H   2 dxz     72  S H   2 dyy     73  S H   2 dyz     74  S H   2 dzz 
    75  S H   3 dxx     76  S H   3 dxy     77  S H   3 dxz     78  S H   3 dyy     79  S H   3 dyz     80  S H   3 dzz 
    81  S H   4 dxx     82  S H   4 dxy     83  S H   4 dxz     84  S H   4 dyy     85  S H   4 dyz     86  S H   4 dzz 


                                GETLAB: SO-labels
                                -----------------

   * Large components:   26
     1  L A  C  s        2  L A  C  dxx      3  L A  C  dyy      4  L A  C  dzz      5  L A  H  s        6  L A  H  px  
     7  L A  H  py       8  L A  H  pz       9  L B2 C  py      10  L B2 C  dxz     11  L B2 H  s       12  L B2 H  px  
    13  L B2 H  py      14  L B2 H  pz      15  L B3 C  px      16  L B3 C  dyz     17  L B3 H  s       18  L B3 H  px  
    19  L B3 H  py      20  L B3 H  pz      21  L B1 C  pz      22  L B1 C  dxy     23  L B1 H  s       24  L B1 H  px  
    25  L B1 H  py      26  L B1 H  pz  
   * Small components:   60
    27  S A  C  s       28  S A  C  dxx     29  S A  C  dyy     30  S A  C  dzz     31  S A  C  fxyz    32  S A  H  s   
    33  S A  H  px      34  S A  H  py      35  S A  H  pz      36  S A  H  dxx     37  S A  H  dxy     38  S A  H  dxz 
    39  S A  H  dyy     40  S A  H  dyz     41  S A  H  dzz     42  S B2 C  py      43  S B2 C  dxz     44  S B2 C  fxxy
    45  S B2 C  fyyy    46  S B2 C  fyzz    47  S B2 H  s       48  S B2 H  px      49  S B2 H  py      50  S B2 H  pz  
    51  S B2 H  dxx     52  S B2 H  dxy     53  S B2 H  dxz     54  S B2 H  dyy     55  S B2 H  dyz     56  S B2 H  dzz 
    57  S B3 C  px      58  S B3 C  dyz     59  S B3 C  fxxx    60  S B3 C  fxyy    61  S B3 C  fxzz    62  S B3 H  s   
    63  S B3 H  px      64  S B3 H  py      65  S B3 H  pz      66  S B3 H  dxx     67  S B3 H  dxy     68  S B3 H  dxz 
    69  S B3 H  dyy     70  S B3 H  dyz     71  S B3 H  dzz     72  S B1 C  pz      73  S B1 C  dxy     74  S B1 C  fxxz
    75  S B1 C  fyyz    76  S B1 C  fzzz    77  S B1 H  s       78  S B1 H  px      79  S B1 H  py      80  S B1 H  pz  
    81  S B1 H  dxx     82  S B1 H  dxy     83  S B1 H  dxz     84  S B1 H  dyy     85  S B1 H  dyz     86  S B1 H  dzz 


  Symmetry Orbitals
  -----------------

  Number of orbitals in each symmetry:           47    44    44    44
  Number of large orbitals in each symmetry:     11     8     8     8
  Number of small orbitals in each symmetry:     36    36    36    36

* Large component functions

  Symmetry  A  ( 1)

        3 functions:    C  s   
        1 functions:    C  dxx 
        1 functions:    C  dyy 
        1 functions:    C  dzz 
        2 functions:    H  s   1+2+3+4
        1 functions:    H  px  1+2-3-4
        1 functions:    H  py  1-2+3-4
        1 functions:    H  pz  1-2-3+4

  Symmetry  B2 ( 2)

        2 functions:    C  py  
        1 functions:    C  dxz 
        2 functions:    H  s   1-2+3-4
        1 functions:    H  px  1-2-3+4
        1 functions:    H  py  1+2+3+4
        1 functions:    H  pz  1+2-3-4

  Symmetry  B3 ( 3)

        2 functions:    C  px  
        1 functions:    C  dyz 
        2 functions:    H  s   1+2-3-4
        1 functions:    H  px  1+2+3+4
        1 functions:    H  py  1-2-3+4
        1 functions:    H  pz  1-2+3-4

  Symmetry  B1 ( 4)

        2 functions:    C  pz  
        1 functions:    C  dxy 
        2 functions:    H  s   1-2-3+4
        1 functions:    H  px  1-2+3-4
        1 functions:    H  py  1+2-3-4
        1 functions:    H  pz  1+2+3+4

* Small component functions

  Symmetry  A  ( 1)

        4 functions:    C  s   
        4 functions:    C  dxx 
        4 functions:    C  dyy 
        4 functions:    C  dzz 
        1 functions:    C  fxyz
        1 functions:    H  s   1+2+3+4
        4 functions:    H  px  1+2-3-4
        4 functions:    H  py  1-2+3-4
        4 functions:    H  pz  1-2-3+4
        1 functions:    H  dxx 1+2+3+4
        1 functions:    H  dxy 1-2-3+4
        1 functions:    H  dxz 1-2+3-4
        1 functions:    H  dyy 1+2+3+4
        1 functions:    H  dyz 1+2-3-4
        1 functions:    H  dzz 1+2+3+4

  Symmetry  B2 ( 2)

       10 functions:    C  py  
        4 functions:    C  dxz 
        1 functions:    C  fxxy
        1 functions:    C  fyyy
        1 functions:    C  fyzz
        1 functions:    H  s   1-2+3-4
        4 functions:    H  px  1-2-3+4
        4 functions:    H  py  1+2+3+4
        4 functions:    H  pz  1+2-3-4
        1 functions:    H  dxx 1-2+3-4
        1 functions:    H  dxy 1+2-3-4
        1 functions:    H  dxz 1+2+3+4
        1 functions:    H  dyy 1-2+3-4
        1 functions:    H  dyz 1-2-3+4
        1 functions:    H  dzz 1-2+3-4

  Symmetry  B3 ( 3)

       10 functions:    C  px  
        4 functions:    C  dyz 
        1 functions:    C  fxxx
        1 functions:    C  fxyy
        1 functions:    C  fxzz
        1 functions:    H  s   1+2-3-4
        4 functions:    H  px  1+2+3+4
        4 functions:    H  py  1-2-3+4
        4 functions:    H  pz  1-2+3-4
        1 functions:    H  dxx 1+2-3-4
        1 functions:    H  dxy 1-2+3-4
        1 functions:    H  dxz 1-2-3+4
        1 functions:    H  dyy 1+2-3-4
        1 functions:    H  dyz 1+2+3+4
        1 functions:    H  dzz 1+2-3-4

  Symmetry  B1 ( 4)

       10 functions:    C  pz  
        4 functions:    C  dxy 
        1 functions:    C  fxxz
        1 functions:    C  fyyz
        1 functions:    C  fzzz
        1 functions:    H  s   1-2-3+4
        4 functions:    H  px  1-2+3-4
        4 functions:    H  py  1+2-3-4
        4 functions:    H  pz  1+2+3+4
        1 functions:    H  dxx 1-2-3+4
        1 functions:    H  dxy 1+2+3+4
        1 functions:    H  dxz 1+2-3-4
        1 functions:    H  dyy 1-2-3+4
        1 functions:    H  dyz 1-2+3-4
        1 functions:    H  dzz 1-2-3+4


   ***************************************************************************
   *************************** Hamiltonian defined ***************************
   ***************************************************************************

 * Print level:    0
 * Dirac-Coulomb Hamiltonian
 * SS integrals neglected:
   Interatomic Coulombic SS-contributions modelled by
   classical repulsion of small component atomic charges
   using tabulated charges.
 * Default integral flags passed to all modules
   - LL-integrals:     1
   - LS-integrals:     1
   - SS-integrals:     0
   - GT-integrals:     0
 * Basis set:
   - uncontracted large component basis set
   - uncontracted small component basis set


 Information about the restricted kinetic balance scheme:
 * Default RKB projection:
   1: Pre-projection in scalar basis
   2: Removal of unphysical solutions (via diagonalization of free particle Hamiltonian)


    **************************************************************************
    ************************** Wave function module **************************
    **************************************************************************

 Wave function types requested (in input order):
     HF        

 Wave function jobs in execution order (expanded):
 * Hartree-Fock calculation
===========================================================================
 *SCF: Set-up for Hartree-Fock calculation:
===========================================================================
 * Number of fermion irreps: 1
 * Closed shell SCF calculation with    10 electrons in    5 orbitals.
 * Sum of atomic potentials used for start guess
 * General print level   :   0

 ***** INITIAL TRIAL SCF FUNCTION *****
 * Trial vectors read from file DFCOEF
 * Scaling of active-active block correction to open shell Fock operator    0.500000
   to improve convergence (default value).
   The final open-shell orbital energies are recalculated with 1.0 scaling,
   such that all occupied orbital energies correspond to Koopmans' theorem ionization energies.

 ***** SCF CONVERGENCE CRITERIA *****
 * Convergence on norm of error vector (gradient).
   Desired convergence:1.000D-07
   Allowed convergence:1.000D-06

 ***** CONVERGENCE CONTROL *****
 * Fock matrix constructed using differential density matrix
    with optimal parameter.
 * DIIS (in MO basis)
 * DIIS will be activated when convergence reaches : 1.00D+20
   - Maximum size of B-matrix:   10
 * Damping of Fock matrix when DIIS is not activated. 
   Weight of old matrix    : 0.250
 * Maximum number of SCF iterations  :   50
 * No quadratic convergent Hartree-Fock
 * Contributions from 2-electron integrals to Fock matrix:
   LL-integrals.
   SL-integrals from iteration    1
    ---> this is default setting from Hamiltonian input
 ***** OUTPUT CONTROL *****
 * Only electron eigenvalues written out.


   ***************************************************************************
   ***************************** Analysis module *****************************
   ***************************************************************************

 Jobs in this run:
 * Mulliken population analysis
 * Projection onto another solution
===========================================================================
 *PROJECT: Projection onto another solution
===========================================================================
 * Threshold for printing projection coefficients: 1.00D-03
 * Number of spinors projected:
    - Orbitals in fermion ircop E1  :   1..   5                                                              
 * Projection analysis based on atomic fragments, 
   calculated in their individual bases
      AFCXXX   1..5                                                                    
      AFH1XX   1                                                                       
 * Print level:    0
===========================================================================
 POPINP: Mulliken population analysis
===========================================================================
 * Gross populations
 * Label definitions based on SO-labels
 * Number of spinors analyzed:
    - Orbitals in fermion ircop E1  :   1..   5                                                              
 * Print level:    0


 ********************************************************************************
 *************************** Input consistency checks ***************************
 ********************************************************************************



    *************************************************************************
    ************************ End of input processing ************************
    *************************************************************************



                      Nuclear contribution to dipole moments
                      --------------------------------------

                    All dipole components are zero by symmetry

Total time used in ONEGEN (CPU)  0.00515300s and (WALL)  0.00500000s


                       Generating Lowdin canonical matrix:
                       -----------------------------------

   L   A     * Deleted:          1(Proj:          1, Lindep:          0) Smin: 0.12E-01
   L   B2    * Deleted:          0(Proj:          0, Lindep:          0) Smin: 0.72E-01
   L   B3    * Deleted:          0(Proj:          0, Lindep:          0) Smin: 0.72E-01
   L   B1    * Deleted:          0(Proj:          0, Lindep:          0) Smin: 0.72E-01
   S   A     * Deleted:          5(Proj:          5, Lindep:          0) Smin: 0.31E-01
   S   B2    * Deleted:          2(Proj:          2, Lindep:          0) Smin: 0.67E-02
   S   B3    * Deleted:          2(Proj:          2, Lindep:          0) Smin: 0.67E-02
   S   B1    * Deleted:          2(Proj:          2, Lindep:          0) Smin: 0.67E-02


                                Output from MODHAM
                                ------------------

 * Applied strict kinetic balance !
 * Applied SL-regrouping on AO2MO tranf.matrix in SLSORT.


      **********************************************************************
      ************************* Orbital dimensions *************************
      **********************************************************************

No. of positive energy orbitals (NESH):    34
No. of negative energy orbitals (NPSH):    34
Total no. of orbitals           (NORB):    68


   ****************************************************************************
   ************************* Hartree-Fock calculation *************************
   ****************************************************************************


*** INFO *** No trial vectors found.
 Using sum of fitted atomic potentials as start potential.

 Reference: arXiv:2002.02587 (small GRASP fit)


########## START ITERATION NO.   1 ##########   Thu May 28 14:39:40 2020

E_HOMO...E_LUMO, symmetry 1:    39  -0.95231   40  -0.24091

=> Calculating sum of orbital energies
It.    1    -16.20430373172      0.00D+00  0.00D+00  0.00D+00               0.01685600s   Atom. scrpot   Thu May 28

########## START ITERATION NO.   2 ##########   Thu May 28 14:39:40 2020


* GETGAB: label "GABAO1XX" not found; calling GABGEN.
SCR        scr.thr.    Step1    Step2  Coulomb  Exchange    CPU-time
SOfock:LL  1.00D-12    0.00%    0.00%    0.09%    0.18%   0.03252800s
SOfock:SL  1.00D-12    0.00%    1.80%    0.05%    0.35%   0.21878199s
 >>> CPU  time used in SO Fock is   0.28 seconds
 >>> WALL time used in SO Fock is   0.28 seconds
E_HOMO...E_LUMO, symmetry 1:    39  -0.24733   40   0.25169
>>> Total wall time:  0.28900000s, and total CPU time :  0.28738000s

########## END ITERATION NO.   2 ##########   Thu May 28 14:39:41 2020

It.    2    -39.50748594449      2.33D+01  4.17D+00  1.60D+00               0.28900000s   LL SL          Thu May 28

########## START ITERATION NO.   3 ##########   Thu May 28 14:39:41 2020

    3 *** Differential density matrix. DCOVLP     = 0.3646
SCR        scr.thr.    Step1    Step2  Coulomb  Exchange    CPU-time
SOfock:LL  1.00D-12    0.00%    0.00%    0.09%    0.11%   0.03279698s
SOfock:SL  1.00D-12    0.00%    2.48%    0.06%    0.34%   0.21566603s
 >>> CPU  time used in SO Fock is   0.25 seconds
 >>> WALL time used in SO Fock is   0.25 seconds
E_HOMO...E_LUMO, symmetry 1:    39  -0.54021   40   0.18700
>>> Total wall time:  0.26000000s, and total CPU time :  0.25745200s

########## END ITERATION NO.   3 ##########   Thu May 28 14:39:41 2020

It.    3    -40.10279175270      5.95D-01 -1.57D+00  6.49D-01   DIIS   2    0.26000000s   LL SL          Thu May 28

########## START ITERATION NO.   4 ##########   Thu May 28 14:39:41 2020

    4 *** Differential density matrix. DCOVLP     = 1.1544
SCR        scr.thr.    Step1    Step2  Coulomb  Exchange    CPU-time
SOfock:LL  1.00D-12    0.00%    0.00%    0.09%    0.11%   0.05509198s
SOfock:SL  1.00D-12    0.00%    2.59%    0.06%    0.35%   0.21215200s
 >>> CPU  time used in SO Fock is   0.27 seconds
 >>> WALL time used in SO Fock is   0.27 seconds
E_HOMO...E_LUMO, symmetry 1:    39  -0.54311   40   0.19396
>>> Total wall time:  0.27800000s, and total CPU time :  0.27623000s

########## END ITERATION NO.   4 ##########   Thu May 28 14:39:41 2020

It.    4    -40.21440704325      1.12D-01  4.45D-01  2.33D-02   DIIS   3    0.27800000s   LL SL          Thu May 28

########## START ITERATION NO.   5 ##########   Thu May 28 14:39:41 2020

    5 *** Differential density matrix. DCOVLP     = 1.0015
SCR        scr.thr.    Step1    Step2  Coulomb  Exchange    CPU-time
SOfock:LL  1.00D-12    0.00%    0.00%    0.09%    0.11%   0.03143704s
SOfock:SL  1.00D-12    0.00%    4.07%    0.05%    0.34%   0.21402103s
 >>> CPU  time used in SO Fock is   0.25 seconds
 >>> WALL time used in SO Fock is   0.25 seconds
E_HOMO...E_LUMO, symmetry 1:    39  -0.54338   40   0.19330
>>> Total wall time:  0.25500000s, and total CPU time :  0.25306300s

########## END ITERATION NO.   5 ##########   Thu May 28 14:39:41 2020

It.    5    -40.21456873254      1.62D-04 -2.43D-03  4.63D-03   DIIS   4    0.25500000s   LL SL          Thu May 28

########## START ITERATION NO.   6 ##########   Thu May 28 14:39:41 2020

    6 *** Differential density matrix. DCOVLP     = 1.0013
SCR        scr.thr.    Step1    Step2  Coulomb  Exchange    CPU-time
SOfock:LL  1.00D-12    0.00%    0.00%    0.09%    0.11%   0.03163695s
SOfock:SL  1.00D-12    0.00%    5.08%    0.06%    0.34%   0.23658299s
 >>> CPU  time used in SO Fock is   0.27 seconds
 >>> WALL time used in SO Fock is   0.27 seconds
E_HOMO...E_LUMO, symmetry 1:    39  -0.54342   40   0.19334
>>> Total wall time:  0.27800000s, and total CPU time :  0.27567900s

########## END ITERATION NO.   6 ##########   Thu May 28 14:39:42 2020

It.    6    -40.21457910781      1.04D-05  5.61D-04  7.34D-04   DIIS   5    0.27800000s   LL SL          Thu May 28

########## START ITERATION NO.   7 ##########   Thu May 28 14:39:42 2020

    7 *** Differential density matrix. DCOVLP     = 1.0002
SCR        scr.thr.    Step1    Step2  Coulomb  Exchange    CPU-time
SOfock:LL  1.00D-12    0.00%    0.00%    0.09%    0.11%   0.03248394s
SOfock:SL  1.00D-12    0.00%    6.58%    0.09%    0.36%   0.21757197s
 >>> CPU  time used in SO Fock is   0.25 seconds
 >>> WALL time used in SO Fock is   0.25 seconds
E_HOMO...E_LUMO, symmetry 1:    39  -0.54343   40   0.19333
>>> Total wall time:  0.25900000s, and total CPU time :  0.25771500s

########## END ITERATION NO.   7 ##########   Thu May 28 14:39:42 2020

It.    7    -40.21457946136      3.54D-07 -5.17D-05  7.33D-05   DIIS   6    0.25900000s   LL SL          Thu May 28

########## START ITERATION NO.   8 ##########   Thu May 28 14:39:42 2020

    8 *** Differential density matrix. DCOVLP     = 1.0000
SCR        scr.thr.    Step1    Step2  Coulomb  Exchange    CPU-time
SOfock:LL  1.00D-12    0.00%    0.00%    0.09%    0.07%   0.03180301s
SOfock:SL  1.00D-12    0.00%    9.42%    0.29%    0.69%   0.21124804s
 >>> CPU  time used in SO Fock is   0.24 seconds
 >>> WALL time used in SO Fock is   0.24 seconds
E_HOMO...E_LUMO, symmetry 1:    39  -0.54344   40   0.19333
>>> Total wall time:  0.25300000s, and total CPU time :  0.25065600s

########## END ITERATION NO.   8 ##########   Thu May 28 14:39:42 2020

It.    8    -40.21457946463      3.27D-09  6.54D-06  4.46D-06   DIIS   7    0.25300000s   LL SL          Thu May 28

########## START ITERATION NO.   9 ##########   Thu May 28 14:39:42 2020

    9 *** Differential density matrix. DCOVLP     = 1.0000
SCR        scr.thr.    Step1    Step2  Coulomb  Exchange    CPU-time
SOfock:LL  1.00D-12    0.00%    0.11%    0.09%    0.07%   0.03179395s
SOfock:SL  1.00D-12    0.00%   15.91%    0.71%    4.66%   0.21542990s
 >>> CPU  time used in SO Fock is   0.25 seconds
 >>> WALL time used in SO Fock is   0.25 seconds
E_HOMO...E_LUMO, symmetry 1:    39  -0.54344   40   0.19333
>>> Total wall time:  0.25700000s, and total CPU time :  0.25481100s

########## END ITERATION NO.   9 ##########   Thu May 28 14:39:42 2020

It.    9    -40.21457946464      6.21D-12  1.47D-06  2.31D-07   DIIS   8    0.25700000s   LL SL          Thu May 28

########## START ITERATION NO.  10 ##########   Thu May 28 14:39:42 2020

   10 *** Differential density matrix. DCOVLP     = 1.0000
SCR        scr.thr.    Step1    Step2  Coulomb  Exchange    CPU-time
SOfock:LL  1.00D-12    0.00%    1.01%    0.29%    0.55%   0.03285694s
SOfock:SL  1.00D-12    0.03%   30.07%    0.66%   16.21%   0.21717501s
 >>> CPU  time used in SO Fock is   0.25 seconds
 >>> WALL time used in SO Fock is   0.25 seconds
>>> Total wall time:  0.25600000s, and total CPU time :  0.25611100s

########## END ITERATION NO.  10 ##########   Thu May 28 14:39:43 2020

It.   10    -40.21457946464     -7.96D-13 -6.77D-08  2.11D-08   DIIS   8    0.25600000s   LL SL          Thu May 28


                                   SCF - CYCLE
                                   -----------

* Convergence on norm of error vector (gradient).
  Desired convergence:1.000D-07
  Allowed convergence:1.000D-06

* ERGVAL - convergence in total energy
* FCKVAL - convergence in maximum change in total Fock matrix
* EVCVAL - convergence in error vector (gradient)
--------------------------------------------------------------------------------------------------------------------------------
           Energy               ERGVAL    FCKVAL    EVCVAL      Conv.acc    CPU          Integrals   Time stamp
--------------------------------------------------------------------------------------------------------------------------------
It.    1    -16.20430373172      0.00D+00  0.00D+00  0.00D+00               0.01685600s   Atom. scrpot   Thu May 28
It.    2    -39.50748594449      2.33D+01  4.17D+00  1.60D+00               0.28900000s   LL SL          Thu May 28
It.    3    -40.10279175270      5.95D-01 -1.57D+00  6.49D-01   DIIS   2    0.26000000s   LL SL          Thu May 28
It.    4    -40.21440704325      1.12D-01  4.45D-01  2.33D-02   DIIS   3    0.27800000s   LL SL          Thu May 28
It.    5    -40.21456873254      1.62D-04 -2.43D-03  4.63D-03   DIIS   4    0.25500000s   LL SL          Thu May 28
It.    6    -40.21457910781      1.04D-05  5.61D-04  7.34D-04   DIIS   5    0.27800000s   LL SL          Thu May 28
It.    7    -40.21457946136      3.54D-07 -5.17D-05  7.33D-05   DIIS   6    0.25900000s   LL SL          Thu May 28
It.    8    -40.21457946463      3.27D-09  6.54D-06  4.46D-06   DIIS   7    0.25300000s   LL SL          Thu May 28
It.    9    -40.21457946464      6.21D-12  1.47D-06  2.31D-07   DIIS   8    0.25700000s   LL SL          Thu May 28
It.   10    -40.21457946464     -7.96D-13 -6.77D-08  2.11D-08   DIIS   8    0.25600000s   LL SL          Thu May 28
--------------------------------------------------------------------------------------------------------------------------------
* Convergence after   10 iterations.
* Average elapsed time per iteration: 
      No 2-ints    :    0.01700000s
      LL SL        :    0.26500000s


                                   TOTAL ENERGY
                                   ------------

   Electronic energy                        :    -53.699455512379750

   Other contributions to the total energy
   Nuclear repulsion energy                 :     13.484876022099337
   SS Coulombic correction                  :      0.000000025640707

   Sum of all contributions to the energy
   Total energy                             :    -40.214579464639705


                                   Eigenvalues
                                   -----------


* Fermion symmetry E1 
  * Closed shell, f = 1.0000
-11.22095823935524  ( 2)    -0.94407937470613  ( 2)    -0.54361205940151  ( 2)    -0.54343700144970  ( 4)
  * Virtual eigenvalues, f = 0.0000
  0.19333083148380  ( 2)     0.27460026822714  ( 2)     0.27467319765358  ( 4)     0.58921605676267  ( 2)     0.58925112403010  ( 4)
  0.89082609634569  ( 2)     0.89115554112272  ( 4)     0.93820468979428  ( 2)     1.13212268000855  ( 4)     1.25694134974187  ( 2)
  1.68906145743310  ( 2)     1.68907972730454  ( 4)     1.89745688794738  ( 2)     1.89746081191475  ( 4)     2.21485554389146  ( 2)
  2.21486101213767  ( 4)     2.54978088527058  ( 4)     2.76034109078439  ( 2)     2.80229108325273  ( 2)     2.80281603151187  ( 4)
* HOMO - LUMO gap:

    E(LUMO) :     0.19333083 au (symmetry E1 )
  - E(HOMO) :    -0.54343700 au (symmetry E1 )
  ------------------------------------------
    gap     :     0.73676783 au



    **************************************************************************
    ********************** Mulliken population analysis **********************
    **************************************************************************



                                 Fermion ircop E1
                                 ----------------



                                 Fermion ircop E1
                                 ----------------


* Electronic eigenvalue no.   1: -11.220958239355       (Occupation : f = 1.0000)           
============================================================================================

* Gross populations greater than 0.00010

Gross     Total   |    L A  C  s      L A  H  s      B2 C  _small   B3 C  _small   B1 C  _small
--------------------------------------------------------------------------------------------------
 alpha    0.9997  |      0.9992         0.0005         0.0000         0.0000         0.0001
 beta     0.0003  |      0.0000         0.0000         0.0001         0.0001         0.0000

* Electronic eigenvalue no.   2: -0.9440793747061       (Occupation : f = 1.0000)           
============================================================================================

* Gross populations greater than 0.00010

Gross     Total   |    L A  C  s      L A  H  s      L A  H  px     L A  H  py     L A  H  pz  
--------------------------------------------------------------------------------------------------
 alpha    1.0000  |      0.5370         0.4352         0.0093         0.0093         0.0093
 beta     0.0000  |      0.0000         0.0000         0.0000         0.0000         0.0000

* Electronic eigenvalue no.   3: -0.5436120594015       (Occupation : f = 1.0000)           
============================================================================================

* Gross populations greater than 0.00010

Gross     Total   |    L B2 C  py     L B2 C  dxz    L B2 H  s      L B2 H  px     L B2 H  py     L B2 H  pz     L B3 C  px  
--------------------------------------------------------------------------------------------------------------------------------
 alpha    0.3333  |      0.0000         0.0000         0.0000         0.0000         0.0000         0.0000         0.0000
 beta     0.6667  |      0.1681         0.0023         0.1589         0.0019         0.0001         0.0019         0.1681

Gross  | L B3 C  dyz    L B3 H  s      L B3 H  px     L B3 H  py     L B3 H  pz     L B1 C  pz     L B1 C  dxy    L B1 H  s   
--------------------------------------------------------------------------------------------------------------------------------
 alpha |   0.0000         0.0000         0.0000         0.0000         0.0000         0.1681         0.0023         0.1589
 beta  |   0.0023         0.1589         0.0001         0.0019         0.0019         0.0000         0.0000         0.0000

Gross  | L B1 H  px     L B1 H  py     L B1 H  pz  
-----------------------------------------------------
 alpha |   0.0019         0.0019         0.0001
 beta  |   0.0000         0.0000         0.0000

* Electronic eigenvalue no.   4: -0.5434370014497       (Occupation : f = 1.0000)           
============================================================================================

* Gross populations greater than 0.00010

Gross     Total   |    L B2 C  py     L B2 C  dxz    L B2 H  s      L B2 H  px     L B2 H  py     L B2 H  pz     L B3 C  px  
--------------------------------------------------------------------------------------------------------------------------------
 alpha    0.0088  |      0.0000         0.0000         0.0000         0.0000         0.0000         0.0000         0.0000
 beta     0.9912  |      0.2167         0.0029         0.2051         0.0025         0.0002         0.0025         0.2830

Gross  | L B3 C  dyz    L B3 H  s      L B3 H  px     L B3 H  py     L B3 H  pz     L B1 C  pz     L B1 H  s   
-----------------------------------------------------------------------------------------------------------------
 alpha |   0.0000         0.0000         0.0000         0.0000         0.0000         0.0044         0.0042
 beta  |   0.0038         0.2678         0.0002         0.0033         0.0033         0.0000         0.0000

* Electronic eigenvalue no.   5: -0.5434370014476       (Occupation : f = 1.0000)           
============================================================================================

* Gross populations greater than 0.00010

Gross     Total   |    L B2 C  py     L B2 C  dxz    L B2 H  s      L B2 H  px     L B2 H  py     L B2 H  pz     L B3 C  px  
--------------------------------------------------------------------------------------------------------------------------------
 alpha    0.6579  |      0.0000         0.0000         0.0000         0.0000         0.0000         0.0000         0.0000
 beta     0.3421  |      0.1194         0.0016         0.1130         0.0014         0.0001         0.0014         0.0531

Gross  | L B3 C  dyz    L B3 H  s      L B3 H  py     L B3 H  pz     L B1 C  pz     L B1 C  dxy    L B1 H  s      L B1 H  px  
--------------------------------------------------------------------------------------------------------------------------------
 alpha |   0.0000         0.0000         0.0000         0.0000         0.3316         0.0045         0.3139         0.0038
 beta  |   0.0007         0.0502         0.0006         0.0006         0.0000         0.0000         0.0000         0.0000

Gross  | L B1 H  py     L B1 H  pz  
--------------------------------------
 alpha |   0.0038         0.0003
 beta  |   0.0000         0.0000


*** Total gross population ***

Gross      Total    |    L A  C  s      L A  H  s      L A  H  px     L A  H  py     L A  H  pz     L B2 C  py     L B2 C  dxz 
--------------------------------------------------------------------------------------------------------------------------------
 total    10.00000  |      3.07243        0.87138        0.01842        0.01842        0.01842        1.00833        0.01356

Gross  | L B2 H  s      L B2 H  px     L B2 H  py     L B2 H  pz     L B3 C  px     L B3 C  dyz    L B3 H  s      L B3 H  px  
--------------------------------------------------------------------------------------------------------------------------------
 total |   0.95401        0.01159        0.00088        0.01159        1.00833        0.01356        0.95401        0.00088

Gross  | L B3 H  py     L B3 H  pz     L B1 C  pz     L B1 C  dxy    L B1 H  s      L B1 H  px     L B1 H  py     L B1 H  pz  
--------------------------------------------------------------------------------------------------------------------------------
 total |   0.01159        0.01159        1.00833        0.01356        0.95401        0.01159        0.01159        0.00088

Gross  | B2 C  _small   B3 C  _small   B1 C  _small
-----------------------------------------------------
 total |   0.00031        0.00031        0.00031


        *****************************************************************
        ********************** Projection analysis **********************
        *****************************************************************



                                 Fermion ircop E1
                                 ----------------


* Electronic eigenvalue nr.   1: -11.220958239355       (Occupation : f = 1.0000)           
============================================================================================
    Orbital            Total           Eigenvalue       Kramers partner 1   Kramers partner 2
    AFCX 1  E     1       1.00002     -0.11343357E+02   ( 1.0000,-0.0000)   (-0.0000, 0.0000)
    AFCX 1  E     2       0.00252     -0.70929225E+00   ( 1.0000,-0.0000)   ( 0.0000,-0.0000)
* Gross contributions:
   AFCX 1               1.0000   E -     1.0000   P -     0.0000
   AFH1 1              -0.0000   E -    -0.0000   P -     0.0000
   AFH1 2              -0.0000   E -    -0.0000   P -     0.0000
   AFH1 3              -0.0000   E -    -0.0000   P -     0.0000
   AFH1 4              -0.0000   E -    -0.0000   P -     0.0000
   Polarization:     0.0000

* Electronic eigenvalue nr.   2: -0.9440793747061       (Occupation : f = 1.0000)           
============================================================================================
    Orbital            Total           Eigenvalue       Kramers partner 1   Kramers partner 2
    AFCX 1  E     1       0.03934     -0.11343357E+02   (-1.0000, 0.0000)   (-0.0000, 0.0000)
    AFCX 1  E     2       0.71228     -0.70929225E+00   ( 1.0000, 0.0000)   (-0.0000, 0.0000)
    AFH1 1  E     1       0.11573     -0.49928475E+00   (-1.0000,-0.0000)   ( 0.0000,-0.0000)
    AFH1 2  E     1       0.11573     -0.49928475E+00   (-1.0000, 0.0000)   (-0.0000,-0.0000)
    AFH1 3  E     1       0.11573     -0.49928475E+00   (-1.0000, 0.0000)   ( 0.0000, 0.0000)
    AFH1 4  E     1       0.11573     -0.49928475E+00   (-1.0000,-0.0000)   (-0.0000, 0.0000)
* Gross contributions:
   AFCX 1               0.6959   E -     0.6959   P -     0.0000
   AFH1 1               0.0715   E -     0.0715   P -     0.0000
   AFH1 2               0.0715   E -     0.0715   P -     0.0000
   AFH1 3               0.0715   E -     0.0715   P -     0.0000
   AFH1 4               0.0715   E -     0.0715   P -     0.0000
   Polarization:     0.0182

* Electronic eigenvalue nr.   3: -0.5436120594015       (Occupation : f = 1.0000)           
============================================================================================
    Orbital            Total           Eigenvalue       Kramers partner 1   Kramers partner 2
    AFCX 1  E     3       0.59615     -0.23133969E+00   (-1.0000,-0.0000)   (-0.0000, 0.0000)
    AFH1 1  E     1       0.28371     -0.49928475E+00   ( 0.0000,-0.5774)   ( 0.5774, 0.5774)
    AFH1 2  E     1       0.28371     -0.49928475E+00   ( 0.0000, 0.5774)   (-0.5774, 0.5774)
    AFH1 3  E     1       0.28371     -0.49928475E+00   ( 0.0000, 0.5774)   ( 0.5774,-0.5774)
    AFH1 4  E     1       0.28371     -0.49928475E+00   ( 0.0000,-0.5774)   (-0.5774,-0.5774)
* Gross contributions:
   AFCX 1               0.5543   E -     0.5543   P -     0.0000
   AFH1 1               0.1075   E -     0.1075   P -     0.0000
   AFH1 2               0.1075   E -     0.1075   P -     0.0000
   AFH1 3               0.1075   E -     0.1075   P -     0.0000
   AFH1 4               0.1075   E -     0.1075   P -     0.0000
   Polarization:     0.0155

* Electronic eigenvalue nr.   4: -0.5434370014497       (Occupation : f = 1.0000)           
============================================================================================
    Orbital            Total           Eigenvalue       Kramers partner 1   Kramers partner 2
    AFCX 1  E     4       0.06832     -0.23110827E+00   ( 1.0000, 0.0000)   ( 0.0000,-0.0000)
    AFCX 1  E     5       0.59201     -0.23110827E+00   (-1.0000, 0.0000)   ( 0.0000,-0.0000)
    AFH1 1  E     1       0.28380     -0.49928475E+00   (-0.0000, 0.0936)   (-0.6556, 0.7492)
    AFH1 2  E     1       0.28380     -0.49928475E+00   (-0.0000,-0.0936)   ( 0.6556, 0.7492)
    AFH1 3  E     1       0.28380     -0.49928475E+00   (-0.0000,-0.0936)   (-0.6556,-0.7492)
    AFH1 4  E     1       0.28380     -0.49928475E+00   (-0.0000, 0.0936)   ( 0.6556,-0.7492)
* Gross contributions:
   AFCX 1               0.5541   E -     0.5541   P -     0.0000
   AFH1 1               0.1076   E -     0.1076   P -     0.0000
   AFH1 2               0.1076   E -     0.1076   P -     0.0000
   AFH1 3               0.1076   E -     0.1076   P -     0.0000
   AFH1 4               0.1076   E -     0.1076   P -     0.0000
   Polarization:     0.0156

* Electronic eigenvalue nr.   5: -0.5434370014476       (Occupation : f = 1.0000)           
============================================================================================
    Orbital            Total           Eigenvalue       Kramers partner 1   Kramers partner 2
    AFCX 1  E     4       0.59201     -0.23110827E+00   ( 1.0000, 0.0000)   (-0.0000,-0.0000)
    AFCX 1  E     5       0.06832     -0.23110827E+00   ( 1.0000,-0.0000)   ( 0.0000, 0.0000)
    AFH1 1  E     1       0.28380     -0.49928475E+00   ( 0.0000, 0.8111)   ( 0.4866, 0.3245)
    AFH1 2  E     1       0.28380     -0.49928475E+00   ( 0.0000,-0.8111)   (-0.4866, 0.3245)
    AFH1 3  E     1       0.28380     -0.49928475E+00   ( 0.0000,-0.8111)   ( 0.4866,-0.3245)
    AFH1 4  E     1       0.28380     -0.49928475E+00   ( 0.0000, 0.8111)   (-0.4866,-0.3245)
* Gross contributions:
   AFCX 1               0.5541   E -     0.5541   P -     0.0000
   AFH1 1               0.1076   E -     0.1076   P -     0.0000
   AFH1 2               0.1076   E -     0.1076   P -     0.0000
   AFH1 3               0.1076   E -     0.1076   P -     0.0000
   AFH1 4               0.1076   E -     0.1076   P -     0.0000
   Polarization:     0.0156
================================================

* Total reference orbital contributions:
    AFCX 1  E     1       2.00022     -0.11343357E+02
    AFCX 1  E     2       1.39171     -0.70929225E+00
    AFCX 1  E     3       1.10857     -0.23133969E+00
    AFCX 1  E     4       1.10814     -0.23110827E+00
    AFCX 1  E     5       1.10814     -0.23110827E+00
    AFH1 1  E     1       0.78839     -0.49928475E+00
    AFH1 2  E     1       0.78839     -0.49928475E+00
    AFH1 3  E     1       0.78839     -0.49928475E+00
    AFH1 4  E     1       0.78839     -0.49928475E+00

* Total gross contributions:
   AFCX 1               6.7168   E -     6.7168   P -     0.0000
   AFH1 1               0.7884   E -     0.7884   P -     0.0000
   AFH1 2               0.7884   E -     0.7884   P -     0.0000
   AFH1 3               0.7884   E -     0.7884   P -     0.0000
   AFH1 4               0.7884   E -     0.7884   P -     0.0000
   Polarization:     0.1297
===========================================================================
* ACMOU1: Coefficients read from unformatted DFCOEF 
          and written to unformatted DFACMO (no symmetry)
===========================================================================

*****************************************************
********** E N D   of   D I R A C  output  **********
*****************************************************


 
     Date and time (Linux)  : Thu May 28 14:39:43 2020
     Host name              : agustin-laptop                          

>>>> Node 0, utime: 2, stime: 0, minflt: 2790, majflt: 0, nvcsw: 16, nivcsw: 35, maxrss: 19156
>>>> Total WALL time used in DIRAC: 3s
  
  Dynamical Memory Usage Summary for Master
  
  Mean allocation size (Mb) :       117.28
  
  Largest          10  allocations
  
      488.28 Mb at subroutine __allocator_track_if_MOD_allocator_registe for WORK in PAMANA                            
      488.28 Mb at subroutine __allocator_track_if_MOD_allocator_registe for WORK in PSISCF                            
      488.28 Mb at subroutine __allocator_track_if_MOD_allocator_registe for WORK in PAMSET - 2                        
      488.28 Mb at subroutine __allocator_track_if_MOD_allocator_registe for WORK in GMOTRA                            
      488.28 Mb at subroutine __allocator_track_if_MOD_allocator_registe for WORK in PAMSET - 1                        
      488.28 Mb at subroutine __allocator_track_if_MOD_allocator_registe for test allocation of work array in DIRAC mai
        0.76 Mb at subroutine __allocator_track_if_MOD_allocator_registe for PAMINP WORK array                         
        0.24 Mb at subroutine __allocator_track_if_MOD_allocator_registe for buf in butobs                             
        0.24 Mb at subroutine __allocator_track_if_MOD_allocator_registe for buf in butobs                             
        0.24 Mb at subroutine __allocator_track_if_MOD_allocator_registe for buf in butobs                             
  
  Peak memory usage:       488.53 MB
  Peak memory usage:        0.477 GB
       reached at subroutine : __allocator_track_if_MOD_allocator_registe
              for variable   : buf in butobs                             
  
 MEMGET high-water mark:     0.00 MB

*****************************************************
DIRAC pam run in /home/agustin/dirac/build/test/projection_analysis
